Unternehmen,Sitz,Anschrift: Straße,Anschrift: PLZ,Anschrift: City,Anschrift: Land,Stammkapital,Gegenstand/Geschäftszweck
AGAY Transport & Logistik Gmbh,"Mannheim, DE",Einsteinstraße 14,68169,Mannheim,DE,25000.00 EUR,"Verwaltung eigenen Vermögens, Handel mit Waren aller Art, insbesondere mit Lebensmitteln sowie die Erbringung von Logistikdienstleistungen aller Art, ferner der Betrieb eines Transportunternehmens im Güterfern- und nahverkehr sowie Abfertigungsspedition, des Weiteren erlaubnisfreier Kurierdienst mit Kfz und die Vermietung von Kraftfahrzeugen"
Walter Umzüge und Logistik GmbH & Co. KG,"Mannheim, DE",Hafenstraße 15,68159,Mannheim,DE,-,
G.V.S. Verwaltungsgesellschaft für die Verwertung von Sonderabfällen mbH,"Mannheim, DE",Otto-Hahn-Strasse 50,68169,Mannheim,DE,27000.00 EUR,"Die Sammlung, Bearbeitung, der Transport und die Verwertung von Sonderabfällen und anderen Produktionsrückständen und -abfällen, deren Behandlung insbesondere durch Verbrennung oder thermische/stoffliche Verwertung, die Vermittlung derartiger Geschäfte sowie die Erprobung und Erforschung von Entsorgungsverfahren für Sonderabfälle, insbesondere von Verbrennungs- und/oder thermischen oder stofflichen Verwertungsmethoden sowie die Vermarktung der daraus gewonnenen Ergebnisse, der Bau und/ oder der Betrieb von Entsorgungsanlagen, insbesondere von Verbrennungs- und/oder thermischen oder stofflichen Verwertungsanlagen ."
Karius Transport GmbH,"Mannheim, DE",Kalthorstraße 4,68307,Mannheim,DE,25000.00 EUR,"Die Durchführung von Kleintransporten bis zu einem zulässigen Gesamtgewicht von 3,5 t einschließlich Anhänger, insbesondere der Lieferverkehr zwischen Herstellern und Großhändlern an Einzelhändler."
Novologistik GmbH Internationale Spedition,"Mannheim, DE",Schwetzinger Str. 71,68165,Mannheim,DE,25000.00 EUR,Die Vermittlung von Frachten im Inland und internationalen Ausland sowie Zollabwicklung und Lagerhaltung.
MARWAY Express Logistik GmbH,"Mannheim, DE",Carl-Reuther-Straße 1,68305,Mannheim,DE,25000.00 EUR,"Erbringung von erlaubnisfreien Dienstleistungen für den Transport, insbesondere Vermittlung und Spedition sowie Durchführung von Dienstleistungen jeglicher dem vorgenannten Geschäftszweck dienender Art."
Durmaz Handels GmbH,"Mannheim, DE",Fruchtbahnhofstraße 3-15,68159,Mannheim,DE,25000.00 EUR,"Der Handel mit sowie der Im- und Export von Transportleergut und Regalen, Elektro- und Haushaltsgeräten sowie Kraftfahrzeugen und Kraftfahrzeugteilen."
Lösch Lagerlogistik GmbH,"Mannheim, DE",Abraham-Lincoln-Allee 16,68309,Mannheim,DE,25000.00 EUR,Logistikberatung und Interimsmanagement.
Yildiz Industrieservice GmbH,"Mannheim, DE",Maria-Rigel-Straße 12,68307,Mannheim,DE,25000.00 EUR,"1. Wartungs-, Reparatur-, Reinigungs- und Logistikarbeiten im industriellen
                Bereich sowie ähnliche Arbeiten aller Art.
                2. Die Vornahme aller Geschäfte, welche direkt oder indirekt mit dem Vorstehenden in Zusammenhang
                stehen.
                3. Die Übernahme der Geschäftsführung fremder Unternehmen."
Helix Logistik GmbH,"Mannheim, DE",Augustaanlage 7-11,68165,Mannheim,DE,70000.00 EUR,"Die Durchführung von Logistikdienstleistungen, Boten- und Kurierdiensten und der Transport von Waren und Gütern aller Art sowie die Durchführung aller damit in unmittelbarem und mittelbarem Zusammenhang stehenden Geschäfte."
leur Transport GmbH & Co. KG,"Karlsruhe, DE",Wikingerstraße 16,76189,Karlsruhe,DE,-,
Air & Sea Stecher Logistics GmbH,"Mannheim, DE",Im Pfeifferswörth 18,68167,Mannheim,DE,50000.00 EUR,Die Besorgung von Speditionsleistungen aller Art. Der Selbsteintritt gem. § 458 HGB ist ausgeschlossen.
PTV Logistics GmbH,"Karlsruhe, DE",Stumpfstraße 1,76131,Karlsruhe,DE,25002.00 EUR,"Entwicklung und Vertrieb von Software; Handel mit Software und damit zusammenhängenden weiteren Produkten (z.B. Hardware) sowie Dienstleistungen, Forschung und Consulting im Bereich des Transportwesens und im EDV- Bereich."
M & M Transport GmbH,"Karlsruhe, DE",Hermann-Müller-Würtz-Str. 12,76189,Karlsruhe,DE,25000.00 EUR,"Die Personenbeförderung mit Taxis und Mietwagen sowie die Durchführung von Kurierdiensten und der An- und Verkauf von Kraftfahrzeugen aller Art. 

Die Gesellschaft darf andere Unternehmen gleicher oder ähnlicher Art erwerben, vertreten oder sich an solchen Unternehmen beteiligen. Sie darf Zweigniederlassungen im In- und Ausland errichten. Die Gesellschaft darf alle Geschäfte vornehmen, die der Erreichung und Förderung des Gesellschaftszweckes dienlich sein können."
Spedition Vogel GmbH,"Karlsruhe, DE",Am Entenfang 12,76185,Karlsruhe,DE,50000.00 DEM,"Der Betrieb einer Spedition sowie aller damit verbundenen Aufgaben und Nebengeschäfte, insbesondere die Durchführung und Vermittlung von Transporten im Güternahverkehr und Güterfernverkehr sowie Hausverwaltungen und alle Geschäfte, die der Genehmigung nach § 34 c) Gewerbeordnung bedürfen. 
Die Gesellschaft darf andere Unternehmen gleicher oder ähnlicher Art übernehmen, vertreten oder sich an solchen Unternehmen beteiligen.  Sie darf auch Zweigniederlassungen errichten."
Oser Logistik GmbH,"Baden-Baden, DE",Steinweg 10,76534,Baden-Baden,DE,25000.00 EUR,Die Durchführung von Transportdienstleistungen.
Vimex UG (haftungsbeschränkt),"Mannheim, DE",Eugen-Bolz-Straße 16,68163,Mannheim,DE,500.00 EUR,"Herstellung, Handel, Ver- und Bearbeitung, Ein- und Ausfuhr von und mit Gebrauchsgütern in den Bereichen Industrie, Technik, Ernährung sowie Land- und Forstwirtschaft, insbesondere von und mit elektrotechnischen und elektronischen Systemen, Holz- und Papierprodukten, Textilien, Verpackungs- und Druckerzeugnissen, Rohstoffen sowie Nahrungsmitteln und Getränken; Erbringung von Dienstleistungen in den vorgenannten Feldern und den Bereichen Beratung und Logistik. Die Gesellschaft kann ferner alle Geschäfte tätigen, die dem Unternehmenszweck dienlich sind bzw. die direkt oder indirekt mit diesem in Zusammenhang stehen. Die Gesellschaft kann Zweigniederlassungen, Betriebsstätten und Tochtergesellschaften im In- und Ausland errichten, sich an Unternehmen im In- und Ausland beteiligen, Tochterunternehmen im In- und Ausland gründen, ihr eigenes Vermögen verwalten sowie Grundeigentum im In- und Ausland erwerben, belasten, verwalten und veräußern."
Dold Speditions-GmbH,"Karlsruhe, DE",Moltkestraße 39,76133,Karlsruhe,DE,25000.00 EUR,Das Befördern von Gütern aller Art.
en logistics GmbH & Co. KG,"Klingenmünster, DE",In den Schelmengärten 9,76889,Klingenmünster,DE,-,
